{
  "$complyVersion": "1.0",
  "slug": "minicorp-analytics",
  "name": "MiniCorp Analytics",
  "category": "Analytics & BI",
  "subcategory": null,
  "description": "Lightweight web analytics with minimal data collection.",
  "website": "https://minicorp.example.com",
  "privacyPolicyUrl": "https://minicorp.example.com/privacy",
  "trustCenterUrl": null,
  "dpaUrl": null,
  "securityPageUrl": null,
  "certifications": ["SOC 2 Type I"],
  "frameworks": ["CCPA"],
  "gdprCompliant": false,
  "ccpaCompliant": true,
  "hipaaCompliant": false,
  "dataLocations": ["US"],
  "hasEuDataCenter": false,
  "subprocessors": [],
  "transferSafeguards": null,
  "supportsDsars": false,
  "hasDesignatedDpo": false,
  "hasRecentBreach": false,
  "encryptionAtRest": false,
  "encryptionInTransit": false,
  "penTestFrequency": null,
  "breachNotificationDays": null,
  "dataRetentionPolicy": null,
  "privacyTechnologies": [],
  "euAiActCompliant": null,
  "aiCapabilities": [],
  "aiTechniques": [],
  "euAiActRole": null,
  "iso42001Certified": false,
  "transparencyScore": 35,
  "dpaAnalysis": null,
  "expertReviews": [],
  "generated": "2026-03-06"
}
